{
  "applicability": {
    "deployment_targets": [],
    "frameworks": [
      "pygame",
      "pyside6",
      "pytest",
      "python"
    ],
    "languages": [
      "pygame",
      "pyside6",
      "pytest",
      "python"
    ],
    "operating_systems": [
      "windows"
    ],
    "repository_markers": [
      ".git"
    ],
    "runtimes": []
  },
  "confidence": {
    "rationale": "Deterministic extraction from repository policy files.",
    "score": 0.8
  },
  "evidence": {
    "accepted_by_user": false,
    "deployment_environment": "",
    "deployment_evidence": "",
    "production_observation_window": "",
    "source_commit": "8a60ff18c2d1215975ffe4c52cfa29e84ffce3c0",
    "source_paths": [
      "AGENTS.md"
    ],
    "source_repository": "C:\\Users\\ppyxe\\Documents\\GitHub\\PS_robot_adaptor",
    "task_or_issue": "local-github-repository-analysis",
    "tests_executed": []
  },
  "id": "ps-robot-adaptor-repository-constraints",
  "incompatible_when": [],
  "procedure": [
    "Deterministic replay tests must stay green. If you touch math, mapping, or state machines, run `.\\.venv\\Scripts\\python.exe -m pytest` and review golden replay outputs before declaring done.",
    "Keep simulation labeling clear in UI: \"SIMULATION\" / \"MOCK\" banners on any view that could be confused for real-device telemetry.",
    "Do not introduce dependencies that touch real HID output, USB descriptors, or robot protocols."
  ],
  "provenance": {
    "created_at": "2026-07-05T09:19:04Z",
    "created_by": "harvest_repositories.py",
    "derived_from": [
      "AGENTS.md"
    ],
    "supersedes": [],
    "updated_at": "2026-07-05T09:19:04Z"
  },
  "reuse": {
    "failed_reuse_count": 0,
    "last_retrieved_at": null,
    "retrieval_count": 0,
    "successful_reuse_count": 0
  },
  "rollback": [
    "Keep the record as candidate or delete it before promotion."
  ],
  "scope": "repository",
  "status": "candidate",
  "summary": "Safety and applicability constraints for PS_robot_adaptor.",
  "tags": [
    "no_real_robot_control",
    "ps-robot-adaptor",
    "pygame",
    "pyside6",
    "pytest",
    "python",
    "repo-agents",
    "repository-constraints",
    "robotics",
    "simulation_only"
  ],
  "title": "PS_robot_adaptor repository constraints",
  "trigger_phrases": [
    "PS_robot_adaptor",
    "constraints",
    "safety",
    "risk"
  ],
  "type": "constraint",
  "verification": [
    "Check AGENTS.md constraints before reusing this repository pattern elsewhere."
  ]
}
