{
  "applicability": {
    "deployment_targets": [],
    "frameworks": [
      "beautifulsoup4",
      "node",
      "openpyxl",
      "playwright",
      "python",
      "tqdm"
    ],
    "languages": [
      "beautifulsoup4",
      "node",
      "openpyxl",
      "playwright",
      "python",
      "tqdm"
    ],
    "operating_systems": [
      "windows"
    ],
    "repository_markers": [
      ".git"
    ],
    "runtimes": []
  },
  "confidence": {
    "rationale": "Deterministic extraction from repository policy files.",
    "score": 0.8
  },
  "evidence": {
    "accepted_by_user": false,
    "deployment_environment": "",
    "deployment_evidence": "",
    "production_observation_window": "",
    "source_commit": "2a54a82453d36d2faba796fc5346db9bdd76c873",
    "source_paths": [
      "AGENTS.md"
    ],
    "source_repository": "C:\\Users\\ppyxe\\Documents\\GitHub\\X_booking",
    "task_or_issue": "local-github-repository-analysis",
    "tests_executed": []
  },
  "id": "x-booking-verification-command-6",
  "incompatible_when": [],
  "procedure": [
    "npm run build"
  ],
  "provenance": {
    "created_at": "2026-10-14T20:33:51Z",
    "created_by": "harvest_repositories.py",
    "derived_from": [
      "AGENTS.md"
    ],
    "supersedes": [],
    "updated_at": "2026-10-14T20:33:51Z"
  },
  "reuse": {
    "failed_reuse_count": 0,
    "last_retrieved_at": null,
    "retrieval_count": 0,
    "successful_reuse_count": 0
  },
  "rollback": [
    "Keep the record as candidate or delete it before promotion."
  ],
  "scope": "repository",
  "status": "candidate",
  "summary": "Canonical verification command from X_booking: npm run build",
  "tags": [
    "beautifulsoup4",
    "branch_sensitive",
    "contact_data",
    "no_patient_data",
    "node",
    "openpyxl",
    "playwright",
    "python",
    "repo-agents",
    "scraper",
    "tqdm",
    "verification-command",
    "x-booking"
  ],
  "title": "X_booking verification command 6",
  "trigger_phrases": [
    "X_booking",
    "verification",
    "npm run build"
  ],
  "type": "command",
  "verification": [
    "Run only when the repository AGENTS.md says the command applies to touched files."
  ]
}
