{
  "applicability": {
    "deployment_targets": [],
    "frameworks": [
      "docx",
      "google_apps_script",
      "node",
      "office_com",
      "pptx",
      "python",
      "slack",
      "streamlit",
      "vercel"
    ],
    "languages": [
      "docx",
      "google_apps_script",
      "node",
      "office_com",
      "pptx",
      "python",
      "slack",
      "streamlit",
      "vercel"
    ],
    "operating_systems": [
      "windows"
    ],
    "repository_markers": [
      ".git"
    ],
    "runtimes": []
  },
  "confidence": {
    "rationale": "Deterministic extraction from repository policy files.",
    "score": 0.8
  },
  "evidence": {
    "accepted_by_user": false,
    "deployment_environment": "",
    "deployment_evidence": "",
    "production_observation_window": "",
    "source_commit": "99cda5c943eb82f38acccd06bc4e222dd3f37a09",
    "source_paths": [
      "AGENTS.md"
    ],
    "source_repository": "C:\\Users\\ppyxe\\Documents\\GitHub\\ORSI",
    "task_or_issue": "local-github-repository-analysis",
    "tests_executed": []
  },
  "id": "orsi-verification-command-5",
  "incompatible_when": [],
  "procedure": [
    "uv pip install --python .\\.venv\\Scripts\\python.exe --link-mode hardlink -r Orsi_Metrics_Research\\scripts\\robotic_cholecystectomy\\videos\\requirements-transcription.txt"
  ],
  "provenance": {
    "created_at": "2026-10-04T09:17:25Z",
    "created_by": "harvest_repositories.py",
    "derived_from": [
      "AGENTS.md"
    ],
    "supersedes": [],
    "updated_at": "2026-10-04T09:17:25Z"
  },
  "reuse": {
    "failed_reuse_count": 0,
    "last_retrieved_at": null,
    "retrieval_count": 0,
    "successful_reuse_count": 0
  },
  "rollback": [
    "Keep the record as candidate or delete it before promotion."
  ],
  "scope": "repository",
  "status": "candidate",
  "summary": "Canonical verification command from ORSI: uv pip install --python .\\.venv\\Scripts\\python.exe --link-mode hardlink -r Orsi_Metrics_Research\\scripts\\robotic_cholecystectomy\\videos\\requirements-transcription.txt",
  "tags": [
    "auth",
    "credentials",
    "docx",
    "external_webhooks",
    "google_apps_script",
    "node",
    "not_clinical",
    "not_robot_control",
    "office_com",
    "orsi",
    "pptx",
    "python",
    "repo-agents",
    "research",
    "slack",
    "streamlit",
    "vercel",
    "verification-command"
  ],
  "title": "ORSI verification command 5",
  "trigger_phrases": [
    "ORSI",
    "verification",
    "uv pip install --python .\\.venv\\Scripts\\python.exe --link-mode hardlink -r Orsi_Metrics_Research\\scripts\\robotic_cholecystectomy\\videos\\requirements-transcription.txt"
  ],
  "type": "command",
  "verification": [
    "Run only when the repository AGENTS.md says the command applies to touched files."
  ]
}
