{
  "applicability": {
    "deployment_targets": [],
    "frameworks": [
      "codex",
      "cursor",
      "python",
      "stdlib"
    ],
    "languages": [
      "codex",
      "cursor",
      "python",
      "stdlib"
    ],
    "operating_systems": [
      "windows"
    ],
    "repository_markers": [
      ".git"
    ],
    "runtimes": []
  },
  "confidence": {
    "rationale": "Deterministic extraction from repository policy files.",
    "score": 0.75
  },
  "evidence": {
    "accepted_by_user": false,
    "deployment_environment": "",
    "deployment_evidence": "",
    "production_observation_window": "",
    "source_commit": "c8eacbe6e885807076debd1de3222090b768f873",
    "source_paths": [
      "skills.md"
    ],
    "source_repository": "C:\\Users\\ppyxe\\Documents\\GitHub\\auto_learning_agent",
    "task_or_issue": "local-github-repository-analysis",
    "tests_executed": []
  },
  "id": "auto-learning-agent-workflow-risk-triggered-systems-engineering-review",
  "incompatible_when": [],
  "procedure": [
    "1. The parent reads active instructions and queries the governed Graphify index first, then verifies relevant claims in source.",
    "2. `workflow_router` classifies the task and recommends no more than two relevant read-only specialists automatically.",
    "3. Select from `systems_architect`, `reliability_operations_reviewer`, `security_boundary_reviewer`, and `quality_release_reviewer`. Run all four only when the user explicitly requests the full panel.",
    "4. Keep specialist selection separate from Luna/Terra/Sol model-cost routing. Specialists inspect and report; they do not edit, publish, or spawn agents.",
    "5. The parent integrates evidence, owns decisions and edits, runs target-repository verification, and sends the integrated result to `verifier`.",
    "6. `verifier` returns the final `READY`, `CONDITIONALLY READY`, or `NOT READY` decision.",
    "7. Record optional `specialist_roles` in routing history only when specialist review materially affected the task. Never invoke model-backed agents from deterministic startup harvesting.",
    "- 2026-08-05: Added a read-only systems-engineering panel with bounded, risk-triggered routing and verifier-owned final readiness."
  ],
  "provenance": {
    "created_at": "2026-10-31T07:24:12Z",
    "created_by": "harvest_repositories.py",
    "derived_from": [
      "skills.md"
    ],
    "supersedes": [],
    "updated_at": "2026-10-31T07:24:12Z"
  },
  "reuse": {
    "failed_reuse_count": 0,
    "last_retrieved_at": null,
    "retrieval_count": 0,
    "successful_reuse_count": 0
  },
  "rollback": [
    "Keep the record as candidate or delete it before promotion."
  ],
  "scope": "repository",
  "status": "candidate",
  "summary": "**Triggered by:** High-risk or cross-boundary architecture, reliability, security, quality, release, migration, provider, database, deployment, or supply-chain work; or an explicit request for the full systems-engineering panel.",
  "tags": [
    "auto_learning_agent",
    "codex",
    "cursor",
    "global_config_preview",
    "python",
    "read_only_audit",
    "repo-workflow",
    "skills-md",
    "stdlib"
  ],
  "title": "auto_learning_agent workflow: Risk-triggered systems-engineering review",
  "trigger_phrases": [
    "auto_learning_agent",
    "Risk-triggered systems-engineering review"
  ],
  "type": "workflow",
  "verification": [
    "Follow the Verification section in the same skills.md workflow before promotion."
  ]
}
