{
  "applicability": {
    "deployment_targets": [],
    "frameworks": [
      "bootstrap",
      "chartjs",
      "mysql",
      "php"
    ],
    "languages": [
      "bootstrap",
      "chartjs",
      "mysql",
      "php"
    ],
    "operating_systems": [
      "windows"
    ],
    "repository_markers": [
      ".git"
    ],
    "runtimes": []
  },
  "confidence": {
    "rationale": "Deterministic extraction from repository policy files.",
    "score": 0.8
  },
  "evidence": {
    "accepted_by_user": false,
    "deployment_environment": "",
    "deployment_evidence": "",
    "production_observation_window": "",
    "source_commit": "1f18c532e608eae147c250fab568d572e3f9a683",
    "source_paths": [
      "AGENTS.md"
    ],
    "source_repository": "C:\\Users\\ppyxe\\Documents\\GitHub\\Xenios_FInances",
    "task_or_issue": "local-github-repository-analysis",
    "tests_executed": []
  },
  "id": "xenios-finances-verification-command-2",
  "incompatible_when": [],
  "procedure": [
    "php -l app\\functions\\transaction_functions.php"
  ],
  "provenance": {
    "created_at": "2026-07-05T09:19:05Z",
    "created_by": "harvest_repositories.py",
    "derived_from": [
      "AGENTS.md"
    ],
    "supersedes": [],
    "updated_at": "2026-07-05T09:19:05Z"
  },
  "reuse": {
    "failed_reuse_count": 0,
    "last_retrieved_at": null,
    "retrieval_count": 0,
    "successful_reuse_count": 0
  },
  "rollback": [
    "Keep the record as candidate or delete it before promotion."
  ],
  "scope": "repository",
  "status": "candidate",
  "summary": "Canonical verification command from Xenios_FInances: php -l app\\functions\\transaction_functions.php",
  "tags": [
    "bootstrap",
    "chartjs",
    "finance",
    "local_only",
    "mysql",
    "php",
    "repo-agents",
    "verification-command",
    "xenios-finances"
  ],
  "title": "Xenios_FInances verification command 2",
  "trigger_phrases": [
    "Xenios_FInances",
    "verification",
    "php -l app\\functions\\transaction_functions.php"
  ],
  "type": "command",
  "verification": [
    "Run only when the repository AGENTS.md says the command applies to touched files."
  ]
}
