{
  "applicability": {
    "deployment_targets": [],
    "frameworks": [
      "node"
    ],
    "languages": [
      "node"
    ],
    "operating_systems": [
      "windows"
    ],
    "repository_markers": [
      ".git"
    ],
    "runtimes": []
  },
  "confidence": {
    "rationale": "Deterministic extraction from repository policy files.",
    "score": 0.8
  },
  "evidence": {
    "accepted_by_user": false,
    "deployment_environment": "",
    "deployment_evidence": "",
    "production_observation_window": "",
    "source_commit": "c6f413f477e07f73decb7e34b679bf43f6f8c026",
    "source_paths": [
      "AGENTS.md"
    ],
    "source_repository": "C:\\Users\\ppyxe\\Documents\\GitHub\\CV",
    "task_or_issue": "local-github-repository-analysis",
    "tests_executed": []
  },
  "id": "cv-verification-command-1",
  "incompatible_when": [],
  "procedure": [
    "npm run verify"
  ],
  "provenance": {
    "created_at": "2026-09-01T18:57:31Z",
    "created_by": "harvest_repositories.py",
    "derived_from": [
      "AGENTS.md"
    ],
    "supersedes": [],
    "updated_at": "2026-09-01T18:57:31Z"
  },
  "reuse": {
    "failed_reuse_count": 0,
    "last_retrieved_at": null,
    "retrieval_count": 0,
    "successful_reuse_count": 0
  },
  "rollback": [
    "Keep the record as candidate or delete it before promotion."
  ],
  "scope": "repository",
  "status": "candidate",
  "summary": "Canonical verification command from CV: npm run verify",
  "tags": [
    "cv",
    "node",
    "repo-agents",
    "verification-command"
  ],
  "title": "CV verification command 1",
  "trigger_phrases": [
    "CV",
    "verification",
    "npm run verify"
  ],
  "type": "command",
  "verification": [
    "Run only when the repository AGENTS.md says the command applies to touched files."
  ]
}
