{
  "applicability": {
    "deployment_targets": [],
    "frameworks": [
      "node"
    ],
    "languages": [
      "node"
    ],
    "operating_systems": [
      "windows"
    ],
    "repository_markers": [
      ".git"
    ],
    "runtimes": []
  },
  "confidence": {
    "rationale": "Deterministic extraction from repository policy files.",
    "score": 0.75
  },
  "evidence": {
    "accepted_by_user": false,
    "deployment_environment": "",
    "deployment_evidence": "",
    "production_observation_window": "",
    "source_commit": "c6f413f477e07f73decb7e34b679bf43f6f8c026",
    "source_paths": [
      "skills.md"
    ],
    "source_repository": "C:\\Users\\ppyxe\\Documents\\GitHub\\CV",
    "task_or_issue": "local-github-repository-analysis",
    "tests_executed": []
  },
  "id": "cv-workflow-translation-review",
  "incompatible_when": [],
  "procedure": [
    "- English is the factual baseline; Italian and Greek drafts require human approval.",
    "- Review every page and detail entry for medical terminology, official names, grammar, links, and factual parity.",
    "- Mark a locale reviewed in `src/content/source-manifest.json` only after approval.",
    "- Run `npm run validate:production` after approval."
  ],
  "provenance": {
    "created_at": "2026-09-01T18:57:31Z",
    "created_by": "harvest_repositories.py",
    "derived_from": [
      "skills.md"
    ],
    "supersedes": [],
    "updated_at": "2026-09-01T18:57:31Z"
  },
  "reuse": {
    "failed_reuse_count": 0,
    "last_retrieved_at": null,
    "retrieval_count": 0,
    "successful_reuse_count": 0
  },
  "rollback": [
    "Keep the record as candidate or delete it before promotion."
  ],
  "scope": "repository",
  "status": "candidate",
  "summary": "English is the factual baseline; Italian and Greek drafts require human approval.",
  "tags": [
    "cv",
    "node",
    "repo-workflow",
    "skills-md"
  ],
  "title": "CV workflow: Translation review",
  "trigger_phrases": [
    "CV",
    "Translation review"
  ],
  "type": "workflow",
  "verification": [
    "Follow the Verification section in the same skills.md workflow before promotion."
  ]
}
