{
  "applicability": {
    "deployment_targets": [],
    "frameworks": [
      "docx",
      "graphviz",
      "matplotlib",
      "numpy",
      "python",
      "streamlit"
    ],
    "languages": [
      "docx",
      "graphviz",
      "matplotlib",
      "numpy",
      "python",
      "streamlit"
    ],
    "operating_systems": [
      "windows"
    ],
    "repository_markers": [
      ".git"
    ],
    "runtimes": []
  },
  "confidence": {
    "rationale": "Deterministic extraction from repository policy files.",
    "score": 0.8
  },
  "evidence": {
    "accepted_by_user": false,
    "deployment_environment": "",
    "deployment_evidence": "",
    "production_observation_window": "",
    "source_commit": "06c3cef0de10adf163f4a550953a6d2c5ad901f2",
    "source_paths": [
      "AGENTS.md"
    ],
    "source_repository": "C:\\Users\\ppyxe\\Documents\\GitHub\\campania_transplant",
    "task_or_issue": "local-github-repository-analysis",
    "tests_executed": []
  },
  "id": "campania-transplant-verification-command-1",
  "incompatible_when": [],
  "procedure": [
    "uv pip install --python .\\.venv\\Scripts\\python.exe --link-mode hardlink -r requirements.txt"
  ],
  "provenance": {
    "created_at": "2026-10-31T07:24:19Z",
    "created_by": "harvest_repositories.py",
    "derived_from": [
      "AGENTS.md"
    ],
    "supersedes": [],
    "updated_at": "2026-10-31T07:24:19Z"
  },
  "reuse": {
    "failed_reuse_count": 0,
    "last_retrieved_at": null,
    "retrieval_count": 0,
    "successful_reuse_count": 0
  },
  "rollback": [
    "Keep the record as candidate or delete it before promotion."
  ],
  "scope": "repository",
  "status": "candidate",
  "summary": "Canonical verification command from campania_transplant: uv pip install --python .\\.venv\\Scripts\\python.exe --link-mode hardlink -r requirements.txt",
  "tags": [
    "campania-transplant",
    "docx",
    "graphviz",
    "health_economics",
    "matplotlib",
    "not_clinical_decision_support",
    "numpy",
    "python",
    "repo-agents",
    "research",
    "streamlit",
    "verification-command"
  ],
  "title": "campania_transplant verification command 1",
  "trigger_phrases": [
    "campania_transplant",
    "verification",
    "uv pip install --python .\\.venv\\Scripts\\python.exe --link-mode hardlink -r requirements.txt"
  ],
  "type": "command",
  "verification": [
    "Run only when the repository AGENTS.md says the command applies to touched files."
  ]
}
