{
  "applicability": {
    "deployment_targets": [],
    "frameworks": [
      "nextjs",
      "postgres",
      "react",
      "tailwind",
      "typescript",
      "vercel"
    ],
    "languages": [
      "nextjs",
      "postgres",
      "react",
      "tailwind",
      "typescript",
      "vercel"
    ],
    "operating_systems": [
      "windows"
    ],
    "repository_markers": [
      ".git"
    ],
    "runtimes": []
  },
  "confidence": {
    "rationale": "Deterministic extraction from repository policy files.",
    "score": 0.8
  },
  "evidence": {
    "accepted_by_user": false,
    "deployment_environment": "",
    "deployment_evidence": "",
    "production_observation_window": "",
    "source_commit": "fd6e896d4eef0ec764d54bd935191bac8bf037a1",
    "source_paths": [
      "AGENTS.md"
    ],
    "source_repository": "C:\\Users\\ppyxe\\Documents\\GitHub\\practice-ops-dashboard",
    "task_or_issue": "local-github-repository-analysis",
    "tests_executed": []
  },
  "id": "practice-ops-dashboard-verification-command-4",
  "incompatible_when": [],
  "procedure": [
    "npm run build"
  ],
  "provenance": {
    "created_at": "2026-07-09T11:40:22Z",
    "created_by": "harvest_repositories.py",
    "derived_from": [
      "AGENTS.md"
    ],
    "supersedes": [],
    "updated_at": "2026-07-09T11:40:22Z"
  },
  "reuse": {
    "failed_reuse_count": 0,
    "last_retrieved_at": null,
    "retrieval_count": 0,
    "successful_reuse_count": 0
  },
  "rollback": [
    "Keep the record as candidate or delete it before promotion."
  ],
  "scope": "repository",
  "status": "candidate",
  "summary": "Canonical verification command from practice-ops-dashboard: npm run build",
  "tags": [
    "auth",
    "database",
    "medical_practice_data",
    "nextjs",
    "postgres",
    "practice-ops-dashboard",
    "react",
    "repo-agents",
    "tailwind",
    "typescript",
    "vercel",
    "verification-command"
  ],
  "title": "practice-ops-dashboard verification command 4",
  "trigger_phrases": [
    "practice-ops-dashboard",
    "verification",
    "npm run build"
  ],
  "type": "command",
  "verification": [
    "Run only when the repository AGENTS.md says the command applies to touched files."
  ]
}
