{
  "applicability": {
    "deployment_targets": [],
    "frameworks": [
      "docx",
      "graphviz",
      "matplotlib",
      "numpy",
      "python",
      "streamlit"
    ],
    "languages": [
      "docx",
      "graphviz",
      "matplotlib",
      "numpy",
      "python",
      "streamlit"
    ],
    "operating_systems": [
      "windows"
    ],
    "repository_markers": [
      ".git"
    ],
    "runtimes": []
  },
  "confidence": {
    "rationale": "Deterministic extraction from repository policy files.",
    "score": 0.8
  },
  "evidence": {
    "accepted_by_user": false,
    "deployment_environment": "",
    "deployment_evidence": "",
    "production_observation_window": "",
    "source_commit": "5ac907a1615ee286c729938da56ab9a152a21e91",
    "source_paths": [
      "AGENTS.md"
    ],
    "source_repository": "C:\\Users\\ppyxe\\Documents\\GitHub\\campania_transplant",
    "task_or_issue": "local-github-repository-analysis",
    "tests_executed": []
  },
  "id": "campania-transplant-repository-constraints",
  "incompatible_when": [],
  "procedure": [
    "Figures must regenerate cleanly from current slider state; never embed hand-tweaked figure files alongside the generators.",
    "Do not commit patient data, raw clinical exports, or unlicensed copies of third-party material."
  ],
  "provenance": {
    "created_at": "2026-10-14T20:30:55Z",
    "created_by": "harvest_repositories.py",
    "derived_from": [
      "AGENTS.md"
    ],
    "supersedes": [],
    "updated_at": "2026-10-14T20:30:55Z"
  },
  "reuse": {
    "failed_reuse_count": 0,
    "last_retrieved_at": null,
    "retrieval_count": 0,
    "successful_reuse_count": 0
  },
  "rollback": [
    "Keep the record as candidate or delete it before promotion."
  ],
  "scope": "repository",
  "status": "candidate",
  "summary": "Safety and applicability constraints for campania_transplant.",
  "tags": [
    "campania-transplant",
    "docx",
    "graphviz",
    "health_economics",
    "matplotlib",
    "not_clinical_decision_support",
    "numpy",
    "python",
    "repo-agents",
    "repository-constraints",
    "research",
    "streamlit"
  ],
  "title": "campania_transplant repository constraints",
  "trigger_phrases": [
    "campania_transplant",
    "constraints",
    "safety",
    "risk"
  ],
  "type": "constraint",
  "verification": [
    "Check AGENTS.md constraints before reusing this repository pattern elsewhere."
  ]
}
