{
  "applicability": {
    "deployment_targets": [],
    "frameworks": [
      "python"
    ],
    "languages": [
      "python"
    ],
    "operating_systems": [
      "windows"
    ],
    "repository_markers": [
      ".git"
    ],
    "runtimes": []
  },
  "confidence": {
    "rationale": "Deterministic extraction from repository policy files.",
    "score": 0.75
  },
  "evidence": {
    "accepted_by_user": false,
    "deployment_environment": "",
    "deployment_evidence": "",
    "production_observation_window": "",
    "source_commit": "c1c4ce018a5bd42f6f23419697d393422951d1d7",
    "source_paths": [
      "skills.md"
    ],
    "source_repository": "C:\\Users\\ppyxe\\Documents\\GitHub\\travel_agent",
    "task_or_issue": "local-github-repository-analysis",
    "tests_executed": []
  },
  "id": "travel-agent-workflow-fallback",
  "incompatible_when": [],
  "procedure": [
    "Follow the `Fallback` workflow documented in skills.md."
  ],
  "provenance": {
    "created_at": "2026-08-03T21:37:22Z",
    "created_by": "harvest_repositories.py",
    "derived_from": [
      "skills.md"
    ],
    "supersedes": [],
    "updated_at": "2026-08-03T21:37:22Z"
  },
  "reuse": {
    "failed_reuse_count": 0,
    "last_retrieved_at": null,
    "retrieval_count": 0,
    "successful_reuse_count": 0
  },
  "rollback": [
    "Keep the record as candidate or delete it before promotion."
  ],
  "scope": "repository",
  "status": "candidate",
  "summary": "If browser automation fails, copy `runs/<run_id>/prompt.md` into ChatGPT manually, paste the answer into the GUI **Manual answer** tab, then click **Process answer**. Preserve this fallback when changing the automated path.",
  "tags": [
    "python",
    "repo-workflow",
    "skills-md",
    "travel-agent"
  ],
  "title": "travel_agent workflow: Fallback",
  "trigger_phrases": [
    "travel_agent",
    "Fallback"
  ],
  "type": "workflow",
  "verification": [
    "Follow the Verification section in the same skills.md workflow before promotion."
  ]
}
