{
  "applicability": {
    "deployment_targets": [],
    "frameworks": [
      "node"
    ],
    "languages": [
      "node"
    ],
    "operating_systems": [
      "windows"
    ],
    "repository_markers": [
      ".git"
    ],
    "runtimes": []
  },
  "confidence": {
    "rationale": "Deterministic extraction from repository policy files.",
    "score": 0.75
  },
  "evidence": {
    "accepted_by_user": false,
    "deployment_environment": "",
    "deployment_evidence": "",
    "production_observation_window": "",
    "source_commit": "c6f413f477e07f73decb7e34b679bf43f6f8c026",
    "source_paths": [
      "skills.md"
    ],
    "source_repository": "C:\\Users\\ppyxe\\Documents\\GitHub\\CV",
    "task_or_issue": "local-github-repository-analysis",
    "tests_executed": []
  },
  "id": "cv-workflow-visual-system-development",
  "incompatible_when": [],
  "procedure": [
    "- Use semantic tokens in `globals.css` and source-owned components.",
    "- Use Lucide for generic icons and accessible labels for icon-only controls.",
    "- Keep Motion and WebGL in the smallest client boundary; prefer transform/opacity, native scrolling, and stable layout.",
    "- Preserve visible CSS/no-JavaScript fallbacks and `prefers-reduced-motion` parity.",
    "- Run `npm run verify` and browser-check `/en`, `/it`, `/el`, mobile navigation, focus, and the 3D fallback."
  ],
  "provenance": {
    "created_at": "2026-09-01T18:57:31Z",
    "created_by": "harvest_repositories.py",
    "derived_from": [
      "skills.md"
    ],
    "supersedes": [],
    "updated_at": "2026-09-01T18:57:31Z"
  },
  "reuse": {
    "failed_reuse_count": 0,
    "last_retrieved_at": null,
    "retrieval_count": 0,
    "successful_reuse_count": 0
  },
  "rollback": [
    "Keep the record as candidate or delete it before promotion."
  ],
  "scope": "repository",
  "status": "candidate",
  "summary": "Use semantic tokens in `globals.css` and source-owned components.",
  "tags": [
    "cv",
    "node",
    "repo-workflow",
    "skills-md"
  ],
  "title": "CV workflow: Visual-system development",
  "trigger_phrases": [
    "CV",
    "Visual-system development"
  ],
  "type": "workflow",
  "verification": [
    "Follow the Verification section in the same skills.md workflow before promotion."
  ]
}
