{
  "applicability": {
    "deployment_targets": [],
    "frameworks": [
      "docx",
      "google_apps_script",
      "node",
      "office_com",
      "pptx",
      "python",
      "slack",
      "streamlit",
      "vercel"
    ],
    "languages": [
      "docx",
      "google_apps_script",
      "node",
      "office_com",
      "pptx",
      "python",
      "slack",
      "streamlit",
      "vercel"
    ],
    "operating_systems": [
      "windows"
    ],
    "repository_markers": [
      ".git"
    ],
    "runtimes": []
  },
  "confidence": {
    "rationale": "Deterministic extraction from repository policy files.",
    "score": 0.75
  },
  "evidence": {
    "accepted_by_user": false,
    "deployment_environment": "",
    "deployment_evidence": "",
    "production_observation_window": "",
    "source_commit": "99cda5c943eb82f38acccd06bc4e222dd3f37a09",
    "source_paths": [
      "skills.md"
    ],
    "source_repository": "C:\\Users\\ppyxe\\Documents\\GitHub\\ORSI",
    "task_or_issue": "local-github-repository-analysis",
    "tests_executed": []
  },
  "id": "orsi-workflow-pbp-evidence-to-curriculum",
  "incompatible_when": [],
  "procedure": [
    "- Read `PBP Surgical training/AGENTS.md`, its project `skills.md`, source catalog, and manifest.",
    "- Use MarkItDown caches before article analysis.",
    "- Treat OpenEvidence as secondary navigation and preserve A/B/C evidence labels.",
    "1. Hash and cache every incoming source before moving it.",
    "2. Identify bibliographic metadata from article content and rename unique PDFs `{LeadAuthor}_{Year}_{short_title}.pdf`.",
    "3. Record exact and DOI/title duplicates before retaining copies under `Research papers/_duplicates/`.",
    "4. Regenerate the manifest, evidence inventory, and one evidence card per unique article.",
    "5. Update the primary-source crosswalk; keep absent cited papers explicitly unverified.",
    "6. Update the 12 synthesis products in order, mapping evidence before designing gates or dependencies.",
    "7. Keep technical proficiency distinct from clinical entrustment and PGY/time distinct from competence.",
    "- 2026-08-31: Initial 27-article corpus, two retained same-article duplicates, OpenEvidence crosswalk, benchmark/learning-curve registries, and 12-part curriculum synthesis."
  ],
  "provenance": {
    "created_at": "2026-10-04T09:17:25Z",
    "created_by": "harvest_repositories.py",
    "derived_from": [
      "skills.md"
    ],
    "supersedes": [],
    "updated_at": "2026-10-04T09:17:25Z"
  },
  "reuse": {
    "failed_reuse_count": 0,
    "last_retrieved_at": null,
    "retrieval_count": 0,
    "successful_reuse_count": 0
  },
  "rollback": [
    "Keep the record as candidate or delete it before promotion."
  ],
  "scope": "repository",
  "status": "candidate",
  "summary": "**Triggered by:** ingesting or synthesizing literature under `PBP Surgical training/`, verifying OpenEvidence claims, extracting thresholds or learning curves, or updating the evidence-linked dependency curriculum.",
  "tags": [
    "auth",
    "credentials",
    "docx",
    "external_webhooks",
    "google_apps_script",
    "node",
    "not_clinical",
    "not_robot_control",
    "office_com",
    "orsi",
    "pptx",
    "python",
    "repo-workflow",
    "research",
    "skills-md",
    "slack",
    "streamlit",
    "vercel"
  ],
  "title": "ORSI workflow: PBP evidence-to-curriculum",
  "trigger_phrases": [
    "ORSI",
    "PBP evidence-to-curriculum"
  ],
  "type": "workflow",
  "verification": [
    "Follow the Verification section in the same skills.md workflow before promotion."
  ]
}
