{
  "applicability": {
    "deployment_targets": [],
    "frameworks": [
      "codex",
      "cursor",
      "python",
      "stdlib"
    ],
    "languages": [
      "codex",
      "cursor",
      "python",
      "stdlib"
    ],
    "operating_systems": [
      "windows"
    ],
    "repository_markers": [
      ".git"
    ],
    "runtimes": []
  },
  "confidence": {
    "rationale": "Deterministic extraction from repository policy files.",
    "score": 0.8
  },
  "evidence": {
    "accepted_by_user": false,
    "deployment_environment": "",
    "deployment_evidence": "",
    "production_observation_window": "",
    "source_commit": "c8eacbe6e885807076debd1de3222090b768f873",
    "source_paths": [
      "AGENTS.md"
    ],
    "source_repository": "C:\\Users\\ppyxe\\Documents\\GitHub\\auto_learning_agent",
    "task_or_issue": "local-github-repository-analysis",
    "tests_executed": []
  },
  "id": "auto-learning-agent-verification-command-18",
  "incompatible_when": [],
  "procedure": [
    ".\\scripts\\run-startup.ps1"
  ],
  "provenance": {
    "created_at": "2026-10-31T07:24:12Z",
    "created_by": "harvest_repositories.py",
    "derived_from": [
      "AGENTS.md"
    ],
    "supersedes": [],
    "updated_at": "2026-10-31T07:24:12Z"
  },
  "reuse": {
    "failed_reuse_count": 0,
    "last_retrieved_at": null,
    "retrieval_count": 0,
    "successful_reuse_count": 0
  },
  "rollback": [
    "Keep the record as candidate or delete it before promotion."
  ],
  "scope": "repository",
  "status": "candidate",
  "summary": "Canonical verification command from auto_learning_agent: .\\scripts\\run-startup.ps1",
  "tags": [
    "auto_learning_agent",
    "codex",
    "cursor",
    "global_config_preview",
    "python",
    "read_only_audit",
    "repo-agents",
    "stdlib",
    "verification-command"
  ],
  "title": "auto_learning_agent verification command 18",
  "trigger_phrases": [
    "auto_learning_agent",
    "verification",
    ".\\scripts\\run-startup.ps1"
  ],
  "type": "command",
  "verification": [
    "Run only when the repository AGENTS.md says the command applies to touched files."
  ]
}
