{
  "applicability": {
    "deployment_targets": [],
    "frameworks": [
      "beautifulsoup4",
      "node",
      "openpyxl",
      "playwright",
      "python",
      "tqdm"
    ],
    "languages": [
      "beautifulsoup4",
      "node",
      "openpyxl",
      "playwright",
      "python",
      "tqdm"
    ],
    "operating_systems": [
      "windows"
    ],
    "repository_markers": [
      ".git"
    ],
    "runtimes": []
  },
  "confidence": {
    "rationale": "Deterministic extraction from repository policy files.",
    "score": 0.75
  },
  "evidence": {
    "accepted_by_user": false,
    "deployment_environment": "",
    "deployment_evidence": "",
    "production_observation_window": "",
    "source_commit": "2a54a82453d36d2faba796fc5346db9bdd76c873",
    "source_paths": [
      "skills.md"
    ],
    "source_repository": "C:\\Users\\ppyxe\\Documents\\GitHub\\X_booking",
    "task_or_issue": "local-github-repository-analysis",
    "tests_executed": []
  },
  "id": "x-booking-workflow-production-promotion-and-rollback",
  "incompatible_when": [],
  "procedure": [
    "- `dev01` has been reviewed and is ready to become production.",
    "- The user has explicitly confirmed that the exact reviewed `dev01` changes may be merged to `main`.",
    "- Legal/privacy/cookie/terms/cancellation/medical disclaimer copy has been reviewed; only then set `compliance.legalReviewed: true`.",
    "- Vercel project is configured with `ACTIVE_CLIENT=dr-alexia`.",
    "- The last verified Vercel deployment URL and Git SHA are recorded for rollback.",
    "1. Verify `dev01`.",
    "2. Obtain explicit user confirmation to promote the exact reviewed `dev01` state.",
    "3. Merge `dev01` into `main`.",
    "4. Push `main`.",
    "5. Confirm Vercel production deploys from `main`.",
    "6. Confirm the production alias points to the verified deployment from `main`.",
    "7. Smoke test `/el`, `/en`, `/book`, `/contact`, legal pages, and `sitemap.xml`.",
    "8. If verification fails, roll back to or promote the prior verified Vercel deployment; do not change DNS.",
    "- 2026-08-06: Vercel is the sole deployment and rollback platform; DNS remains unchanged.",
    "- 2026-06-20: Promotion from `dev01` to `main` now requires explicit user confirmation for the reviewed changes."
  ],
  "provenance": {
    "created_at": "2026-10-14T20:33:51Z",
    "created_by": "harvest_repositories.py",
    "derived_from": [
      "skills.md"
    ],
    "supersedes": [],
    "updated_at": "2026-10-14T20:33:51Z"
  },
  "reuse": {
    "failed_reuse_count": 0,
    "last_retrieved_at": null,
    "retrieval_count": 0,
    "successful_reuse_count": 0
  },
  "rollback": [
    "Keep the record as candidate or delete it before promotion."
  ],
  "scope": "repository",
  "status": "candidate",
  "summary": "Use this workflow only for an approved production promotion of Dr. Alexia's site.",
  "tags": [
    "beautifulsoup4",
    "branch_sensitive",
    "contact_data",
    "no_patient_data",
    "node",
    "openpyxl",
    "playwright",
    "python",
    "repo-workflow",
    "scraper",
    "skills-md",
    "tqdm",
    "x-booking"
  ],
  "title": "X_booking workflow: Production promotion and rollback",
  "trigger_phrases": [
    "X_booking",
    "Production promotion and rollback"
  ],
  "type": "workflow",
  "verification": [
    "Follow the Verification section in the same skills.md workflow before promotion."
  ]
}
